ID,Name,canonical_outcomes
203,Accused person acquitted,Acquitted
204,"Proposed order to remit the case file to the trial Magistrate or his successor in office to compose a proper judgement in  compliance with section 312(2) of the CPA is, in the circumstances of this matter, superfluous, thus allow the appeal, quash the conviction and set aside the sentence of three (3) years in community service and the compensation of TZS 1,500,000/=.",Allowed | Quashed | Remitted
205,"Accused person be kept in a mental health Hospital, as a mental disordered offender",Sentenced
206,Proceedings of the subordinate court are nullified  meanwhile the accused shall remain in custody pending the holding of fresh committal proceedings and his ultimate trial.,Proceedings nullified
207,"Proceedings of the subordinate court are nullified meanwhile, the accused shall remain in custody pending the holding of fresh committal proceedings and his ultimate trial.",Proceedings nullified
208,"Court partly allow the appeal and the result effect is that, we quash the conviction and set aside the sentence imposed upon the appellant and the compensation order for payment of TZS. lm to each victim. We further make an order of the immediate release of the appellant, Ibrahim Eston, from prison unless he is otherwise lawfully held.",Allowed in part | Quashed | Release ordered
209,"In a nutshell, the prosecution did not discharge its duty of proving the case to the standard required, therefore, the appeal is merited and it is allowed. Consequently, the court  order the immediate release of the appellant forthwith unless if held for some other lawful cause.",Allowed | Discharged | Release ordered
210,"It was wrong to sentence the appellant to life imprisonment and in addition three strokes of a cane,  thus quash the sentences meted on the appellant and allow the appeal to the term served. Consequently, the appellant should be released forthwith unless held for other lawful cause.",Allowed | Quashed | Release ordered
229,"For the avoidance of doubts, nullify the proceedings, quash the judgment and set aside the sentence,  order the record to be remitted to the High Court for a retrial according to law, meanwhile the appellant shall remain in custody.",Quashed | Proceedings nullified | Retrial ordered | Remitted
211,"In the circumstances, we remain with no option other than agreeing with Ms. Makala that, having discarded the evidence of PW1, the remaining evidence on record is insufficient to sustain the appellant's conviction, it follows therefore that, the case against the appellant was not proved beyond reasonable doubt. Consequently,  allow the appeal, quash conviction and set aside the appellant's sentence,  order immediate release of the appellant from prison unless held therein for a lawful cause.",Allowed | Quashed | Release ordered
212,Revision dismissed,Dismissed
213,"It is settled that such an order will be at loggerhead with the justice of this case,  instead, the court  agree with Mr. Mwita again who invited us to set the appellant free and leave the matter at the DPP's good wisdom to decided whether to prosecute again or not, this course of action was taken by the Court in Joseph Ngadupa Akilimbaya (supra) and  shall do the same but on condition that such decision by the DPP must be taken not later than 18 months from the date of delivery of this judgment,  accordingly, order the release of the appellant forthwith unless he is being held for some other lawful cause.",Settled by consent | Release ordered
214,"Court find merit in the appeal and we allow it. Accordingly,  quash the conviction, set aside the sentence and order that the appellant be immediately set free unless held for some other lawful cause.",Allowed | Quashed
215,"Nullify the judgment and proceedings of the High Court and remit the record thereof for redetermination of appeal before another judge,  Since this is an old case, court direct that the rehearing of the appeal be done expeditiously.",Proceedings nullified | Remitted
216,"Court satisfied that the prosecution case was not proved beyond reasonable doubt. Consequently,  allow the appeal, quash conviction and set aside the life imprisonment sentence imposed on the appellant, order his immediate release from prison unless otherwise he is lawfully held.",Allowed | Quashed | Release ordered
217,"Appeal is partly allowed to the extent shown herein above. In the circumstances and from the fact that the appeal arose from a labour dispute, we make no order as to costs.",Allowed in part
218,Appeal fails in its entirety and is accordingly dismissed,Dismissed
219,"Appeal allowed, nullify the proceedings and judgment, quash the conviction and set aside the sentence by the trial court, do the same to the proceedings and judgment of the High Court sustaining the trial court's decision,  hereby order the appellant to be released from prison forthwith if not held therein for any other justifiable cause.",Allowed | Quashed | Proceedings nullified | Release ordered
561,"In the final analysis, the Court  find that the appeal is devoid of merit and accordingly dismiss it in its entirety.",Dismissed
221,"Application granted  and order that the execution of the Judgment and Decree of the High Court (Land Division) in Land Case No. 60 of 2022 which was delivered on 7th March, 2023, be stayed pending the hearing and determination of Civil Appeal No. 800 of 2023 pending in the Court, further order that the applicants should deposit a Bank's Guarantee covering the value of the disputed land to the tune of 5 million Shillings as security for the due performance of the decree within thirty days from the date of the delivery of this Ruling.",Allowed
222,"Appeal  allowed , accordingly  quash the appellant's conviction and substitute it with an acquittal resulting into setting aside the sentence imposed on the appellant, consequently,  order for immediate release of the appellant from prison unless he is being held for some other lawful cause",Allowed | Acquitted | Quashed | Sentence substituted | Release ordered
223,"Invoke revision powers under section 4 (2) of the Appellate Jurisdiction Act [CAP 141 R.E.2019] and hereby quash and set aside the trial proceedings and the impugned judgment together with the subsequent orders, direct the case file to be returned to the High Court for an expedited trial prior to which parties should be required to amend the pleadings and join the Registrar.",Quashed
224,"Accept the invitation extended to us by the learned counsel of the parties and hereby invoke our power of revision bestowed upon us under section 4 (2) of the Appellate Jurisdiction Act, Cap 141 of the Revised Edition 2019, quash and set aside the entire proceedings and judgment of the trial court together with subsequent orders, further direct that Land Case No. 46 of 2014 be set down for trial after the Registrar of Titles is joined as a party in terms of Order 1 Rule 10 (2) of the CPC,",Quashed
225,"Appeal allowed, quash the appellants' convictions and set aside their sentences, order the appellants to be released forthwith from prison, unless they are otherwise lawfully held.",Allowed | Quashed | Release ordered
226,"Court find merit in the appeal which  accordingly allow,  order for the immediate release of the appellants from prison if they are not otherwise detained for some other lawful cause.",Allowed | Release ordered
227,"Appeal allowed, quash the appellant's convictions and set aside the sentences imposed on all counts by the trial court and sustained by the High court,  order that he be set free forthwith if not held for any justifiable cause.",Allowed | Quashed
228,"Allow the appellants' appeal in its entirety,  further proceed to order the appellants to be released from prison forthwith unless they are otherwise lawfully held.",Allowed | Release ordered
230,"Appeal, therefore, has merit and it is allowed, consequently quash the conviction and set aside the sentence imposed against the appellant  further order for his immediate release from custody unless therein withheld for other lawful reasons.",Allowed | Quashed | Release ordered
231,"Applicant has not accounted for each day of the delay as required and has offended the requirement for a litigant to observe the time schedule for the taking of steps in judicial proceedings, accordingly proceed to dismiss the application with cost for the reasons stated above.",Dismissed
232,"Since the applicant bears the burden of proof, it is upon him to clear the doubts as regards the two stories told by the two affidavits, this he has not been able to do the affidavit which was served on the respondent contradicts the one on record and since this fact was raised in the affidavit in reply, it is not extraneous, the court hold that the application is incompetent for being supported by an untrue affidavit.",Struck out
233,"In exercise of our revisional powers under section 4 (2) of the Appellate Jurisdiction Act, Cap 141 R. E. 2019, quash and set aside the dismissal order by the High Court in Revision No. 47 of 2016  and, in lieu thereof, substitute it with an order striking out the application.",Dismissed | Quashed
234,"Invoke our revisional jurisdiction under section 4(2) of the AJA, quash and set aside the trial proceedings subsequent to the amendment order dated 7/2/2019, the impugned judgment and subsequent orders, further direct that, the case file be returned to the High Court for it to conduct an expedited trial given that the case file has been in the court corridors for the past 24 years.",Quashed
235,"Application is meritorious, it is granted as prayed, the applicant is given five (5) days reckoned from the date of delivery of this ruling within which to serve the respondent with the memorandum and record of appeal.",Allowed
236,"Allow the appeal and proceed to quash and set aside the impugned conviction and sentence, the appellant should be promptly released from prison, unless otherwise incarcerated in accordance with the law.",Allowed | Quashed | Release ordered
237,"Applicant did not demonstrate any good cause that would entitle her to the sought extension, in the result, the application is not merited it is accordingly dismissed in its entirety.",Dismissed
238,The Court do not find cogent reasons to disturb the concurrent findings of the two courts as such uphold the conviction and sentence of the appellant and proceed to dismiss the appeal in its entirety.,Dismissed | Sentenced
239,"Appeal stands dismissed in ground one   nevertheless, in view of the illegality in the determination of ancillary reliefs by both the trial court and the first appellate court,  constrained to exercise revisional power under section 4 (2) of the ADA to correct the illegality in the judgments of both courts consequently, quash the orders of division of assets and custody of children made by the first appellate court and the trial court for being a nullity.",Dismissed | Quashed | Proceedings nullified
240,"Preliminary objection by the first respondent is upheld, application is thus struck out with costs.",Struck out
241,Appeal lacking in merit and proceed to dismiss it in its entirety.,Dismissed
242,Appeal is accordingly dismissed,Dismissed
243,"Appeal unmerited, the Court accordingly, dismiss it in its entirely.",Dismissed
244,Appeal to have no merit and dismiss it in its entirety,Dismissed
245,"Appeal is partly allowed, whereas, the conviction on the second count of unnatural offence is quashed and the respective sentence of life imprisonment is set aside, the conviction on the first count of rape and its respective sentence of thirty (30) years' imprisonment, are sustained.",Allowed in part | Quashed
246,"The court accordingly, invoke  revisonal powers under section 4(2) of the Appellate Jurisdiction Act and set aside the judgment and decree of the trial court and nullify the proceedings thereof, further direct that the record be remitted to the trial court for trial before another judge after the Rungwe District Council had been joined as a party.",Proceedings nullified | Remitted
247,"Appeal allowed, quash the conviction and set aside the sentence order the appellant's release immediately if his continued incarceration is not for another lawful cause.",Allowed | Quashed | Release ordered
248,"Appellant's appeal allowed,  quash the conviction and set aside the sentence of thirty (30) years imposed upon the appellant further make an order of the immediate release of the appellant, John Mohamed, from prison unless he is otherwise lawfully held.",Allowed | Quashed | Release ordered
249,"No merit in the appellant's appeal, henceforth dismiss it with costs.",Dismissed
250,"Appellant's appeal allowed, quash his conviction and set aside the custodial sentence imposed on him, proceed to order his immediate release from prison forthwith, unless held for some other lawful cause.",Allowed | Quashed | Release ordered
251,Appeal allowed  and order that the appellants be released from prison forthwith if no other justifiable cause holds them therein.,Allowed | Release ordered
252,"Appeal is devoid of merit, and  hereby dismiss it with costs.",Dismissed
253,Application granted  pursuant to rule 11 (2) of the Rules and suspend the execution of the distress warrant issued pending hearing and determination of the intended appeal.,Allowed
254,"Appeal allowed,  consequently  quash the conviction, set aside the sentence and the subsequent order made thereof,  further make an order that the appellant be immediately set free unless held for some other lawful cause.",Allowed | Quashed
255,"Exercising the  revisional powers under section 4 (2) of the Appellate Jurisdiction Act, Cap. 141,  nullify the proceedings and the decision of the High Court which dismissed the appeal of the appellant and make an order that the hearing of Civil Appeal No. 46 of 2020 should proceed accordingly, this point suffices to dispose of the entire appeal, as such find it unnecessary to deliberate on the ground of appeal raised by the appellant.",Dismissed | Proceedings nullified
256,Application granted   and order the applicant within fourteen (14) days to file the intended written submissions.,Allowed
257,"In view of the foregoing, and having found that this appeal is time-barred,  no need to address the second issue concerning the variation in the names of the parties in the records of DLHT and this court,  accordingly, the appeal is hereby dismissed with costs for being time barred.",Struck out | Dismissed
258,"Appeal is devoid of merit, and hereby dismiss it with costs.",Dismissed
259,Applicant is granted extension of time to file a notice of appeal within thirty (30) days from the date of delivery of this ruling.,Allowed
260,"In terms of Rule 11 (5) (b) of the Rules, the court  order the applicant to deposit with the Registrar of the Court an irrevocable bank guarantee in the sum of USD 357,926.061, the intended bank guarantee should be amenable to renewal to cover the whole period until the pending appeal is determined and it should be deposited within sixty (60) days from the date of this order.",Allowed
261,"n pursuance of section 4 (2) of the AJA,  quash all proceedings in Matrimonial Cross -Appeal No. 30 of 2020, set aside the resultant judgment and decree, on the other hand, quash all the proceedings in Matrimonial Appeal No. 24 of 2020 from 18 November, 2020 and set aside judgment and the resultant decree, going forward,  direct that the record in from which Matrimonial Appeal No. 24 of 2020 emanated shall be expeditiously remitted to the High Court with a view to a hearing of that appeal afresh upon the respondent re- filing her cross-appeal in that file not later than 30 days from the date of this ruling.",Quashed | Retrial ordered | Remitted
262,"Appeal allowed, quash the proceedings in relation to the appellant and the conviction entered,  set aside the sentence imposed on the appellant and order that the Tshs. 500,000/= he paid as fine in lieu of imprisonment be refunded to him,",Allowed | Quashed
263,"Appeal allowed accordingly, nullify and quash the judgment of the High Court and set aside all consequential orders, remit the case file to the High Court for composing a judgment after hearing the parties on the new issues,  make no order as to costs to the parties as none of them is blameworthy of the path taken by the 1st appellate court.",Allowed | Quashed | Proceedings nullified | Remitted
264,Application lacks merit and  dismiss it with cost.,Dismissed
265,"Appellant's conviction and sentence were well-grounded and we find nothing on which to fault the concurrent finding of the two lower courts, accordingly, the court  find the appeal barren of fruits and we dismiss it in its entirety.",Dismissed | Sentenced
266,"Appeal allowed,  for that reason, quash the conviction and set aside the sentence,  order the immediate release of the appellant if he is not in custody for some other lawful cause.",Allowed | Quashed | Release ordered
267,"Appeal is meritorious and  allowed, consequently, quash the appellants' convictions and set aside the sentences thereof,  further order for the immediate release of the appellants from prison unless they are otherwise held for other lawful purposes.",Allowed | Quashed | Release ordered
268,Appeal is without any merit and it is hereby dismissed.,Dismissed
269,"No merit in ground one and having so held, the court  see no need discussing other grounds which were dependent on the determination of ground one. Consequently,  dismiss the appeal for lack of merit. The respondent shall have her costs in this Court and the trial court.",Dismissed
270,"Appeal allowed,  conviction for the offence of murder is thus quashed and the sentence meted out thereat is accordingly set aside, in the end order the immediate release of the appellant, if not lawfully held for some other causes.",Allowed | Quashed | Release ordered
271,Appeal  dismissed in its entirety.,Dismissed
272,The Court sustain  the two points of abjection and hereby strike out the appeal with costs.,Struck out
273,Appellant's appeal has no merit and  accordingly dismiss it with costs.,Dismissed
274,"Appeal allowed,  consequently, nullify and quash the judgment of the trial court in Civil Case No. 10 of 2013 dated 6th November, 2020 and set aside the decree thereof, accordingly,  order the case file to be remitted to the trial court for it to compose a fresh judgment in accordance with law.",Allowed | Quashed | Proceedings nullified | Remitted
295,"Applicant has failed to demonstrate that the assailed judgment of the Court is manifestly erroneous and unjust, in the event, the court  dismiss the application with costs.",Dismissed
325,"The Court find merit in the preliminary objection, accordingly,  sustain it in the light of the foregoing, this application for stay of execution suffers incompetence and I hereby strike it with costs.",Struck out | Allowed
275,"Invoke the provision of section 4(2) of the ADA to revise and nullify the proceedings of the District Court of Magu dated 21st October, 2016 and those of the High Court in Criminal Sessions Case No. 163 of 2016, quash the conviction and set aside the sentence. emit the case file in PI Case No. 38 of 2014 to the District Court of Magu to conduct fresh committal proceedings before another magistrate as soon as practicable, further order that, the appellant should remain in custody pending the holding of fresh committal proceedings.",Quashed | Proceedings nullified
276,"Appellant was properly convicted on his own plea of guilty and was also properly sentenced, the appeal is without merit and is hereby dismissed in its entirety.",Dismissed | Convicted | Sentenced
277,"In exercise of our revisional powers in terms of section 4(2) of the ADA,  proceed to substitute the said sentence with the minimum sentence of thirty years imprisonment which was imposed by the trial court, for the foregoing reasons, and to the above extent, the appeal is partly allowed and partly disallowed.",Allowed in part | Sentence substituted | Sentenced
278,"Appellant committed the offence with which he stood charged, the sentence of life imprisonment meted out on him was the minimum sentence prescribed by law and, therefore the position taken by the learned Judge is consistent with the facts of the case and the law.  we have  no reason to interfere with it, the net result of what we have said is that, we find no merit in this appeal which we accordingly dismiss in its entirety.",Dismissed | Sentenced
279,"ln view of the foregoing, we are constrained to sustain the points of preliminary objection raised by the counsel for the respondents, and find the appeal Is Incompetent. All said, we accordingly strike out the purported appeal with no order as to costs.",Struck out
280,"Since the  finding disposes of the appeal, the court see no compelling reasons to consider the remaining grounds of appeal raised by the appellant. In the event, and for the foregoing reasons, the court hereby dismiss the appeal in its entirety with costs.",Dismissed
281,"Application granted   for stay of execution pending  the hearing and determination of the intended appeal, on a condition that the USD 600,000.00 already deposited at the Judiciary account considered as a security for the due performance of the decree.",Allowed
282,"In the final analysis, we decline to exercise our discretion in favour of the applicants, as we maintain that the matter at hand does not reveal any justifiable grounds for the delay in filing the amended record of appeal. Consequently, we dismiss the application with costs.",Dismissed
283,"Application is thus, hereby granted",Allowed
284,"The court has  quashed and set aside the sentence of seven (7) years' imprisonment on the first, second and third counts and substitute it with the sentence of five (5) years' imprisonment, the substituted sentence, in our view, is appropriate in the case at hand. However, uphold the sentence of the trial court of two years imprisonment on the fourth and fifth counts respectively and also, uphold the order that all sentences should run concurrently. The substituted sentence should run from the date of the appellant's conviction.",Quashed | Sentence substituted
285,"Appeal is incompetent due to the defective record of appeal, consequently, we strike it out with costs.",Struck out
286,"Applicant has not furnished sufficient grounds to warrant review of the decision of the Court in terms of Rule 66 (1) (a) and (b) of the Rules, in the upshot, we find the application to be wanting in merit and we accordingly dismiss it.",Dismissed
287,"The court nullify the entire proceedings, quash the judgment and set aside the resultant decree of the trial court dated 7th May, 2021 but issued on 2nd June, 2021.",Quashed | Proceedings nullified
288,"Appeal is dismissed in its entirety, for lack of merit.",Dismissed
289,"In the end, the court  substitute the sentence imposed for a sentence that will allow the 1st and 2nd appellants to be released immediately from imprisonment unless otherwise held for other lawful purposes. All in all, the court  dismiss the appeal, save for the sentence which we have substituted as stated herein.",Dismissed | Sentence substituted | Sentenced | Release ordered
290,Appeal is not meritorious and we accordingly dismiss it in its entirety.,Dismissed
291,"On the way forward, taking into account the circumstances of this case, we are of the firm view that justice demands that the appellant be set free unless otherwise held for lawful purposes.",Release ordered
292,"In the result, the court  satisfied that the appeal is meritorious and thus allowed with costs. Consequently,  quash the impugned judgment and decree and set aside the orders issued by the trial court.",Allowed | Quashed
293,"Appeal allowed,  the judgment, proceedings and the decree of the Mining Commission are hereby quashed and set aside. Further,  direct the Mining dispute No. 04 of 2022 between the parties herein be heard afresh and expeditiously by another Arbiter according to the prevailing laws.",Allowed | Quashed | Retrial ordered
294,"Consequently, in terms of section 4 (2) of the ADA, the court  hereby quash the proceedings and judgment of the trial court and set aside the conviction and the sentence meted against the appellant, the record of this appeal shall be remitted to the trial court for retrial before another Judge in accordance with the law.",Quashed | Retrial ordered | Remitted
297,"Appeal has merit to the extent explained in the second limb of ground 3. In view of the irregularity in relation to the assessor, the court  quash and set aside the judgment of the Tribunal, the proceedings and judgment of the first appellate court, going forward, the court  direct that the record of the DLHT be remitted expeditiously with a view to composition of a judgment afresh upon the remaining assessor filing his written opinion to be read to the parties in accordance with the law.",Allowed | Quashed | Retrial ordered | Remitted
298,Appeal allowed and order that the appellants shall be released forthwith from custody if not held therein lawfully on another cause.,Allowed | Release ordered
299,Appeal is hereby dismissed for lack of merits.,Dismissed
300,Appeal is allowed in part as indicated in this judgment with costs.,Allowed in part
301,"The Court nullify the judgment of DLHT of Chato in Land Application No. 10 of 2017 and set aside the decree, the nullification also applies to the proceedings of the High Court in Land Appeal No. 38 of 2019 as they emanated from nullity proceedings. In the final analysis, the court  accordingly order that the matter be placed before the DLHT for conducting the visit to the locus in quo as earlier on ordered in accordance with the law and later determine the dispute between the parties as soon as practicable.",Proceedings nullified
