ID,Name,canonical_outcomes
2,Accused person convicted,Convicted
3,"Allow  appellant's appeal, quash conviction, set aside the sentence imposed on him and proceed to order his immediate release from custody unless otherwise lawfully held",Allowed | Quashed | Release ordered
4,"Allow the first ground of appeal and hold that, the prosecution case was not proved beyond reasonable doubt",Allowed
5,Appeal allowed,Allowed
6,"Appeal allowed  and consequently, quash the proceedings of both the Tribunal and the High Court and set aside the resultant Judgments",Allowed | Quashed
7,Appeal  allowed and order the appellant to be released from custody unless he is otherwise held for other lawful cause (s).,Allowed | Release ordered
8,Appeal allowed quash and set aside the appellant's conviction for murder and sentence of death,Allowed | Quashed
9,"Appeal allowed, quash conviction and set aside the appellant's death sentence, immediate release of the appellant from prison unless held for other lawful cause.",Allowed | Quashed | Release ordered
10,"Appeal allowed, quash conviction and set aside the sentence imposed on the appellant,  the appellant should be released from prison forthwith, unless held for other lawful cause.",Allowed | Quashed | Release ordered
11,"Appeal allowed , quash conviction of murder against the appellant and set aside the sentence of death passed, and substitute for a conviction of manslaughter.",Allowed | Quashed
12,"Appeal allowed, quash the appellant's conviction and set aside the sentence meted out on him by the trial court and subsequently sustained by the first appellate court. We order for the appellant's immediate release from prison if he is not otherwise detained for some other lawful cause.",Allowed | Quashed | Release ordered
13,"Appeal allowed, quash the appellant's conviction and set aside the sentence. The appellant should be released from prison forthwith unless he is held for other lawful cause",Allowed | Quashed | Release ordered
14,"Appeal allowed, quash the conviction and set aside the sentence and the appellant be immediately set free unless held for some other lawful cause.",Allowed | Quashed
15,"Appeal allowed, quash the conviction and set aside the sentence imposed on him. We further order the appellant be released from the prison forthwith unless he is otherwise lawfully held",Allowed | Quashed | Release ordered
16,"Appeal allowed, quash the convictions and set aside the sentence the appellants be immediately set free unless held for some other lawful cause.",Allowed | Quashed
46,Appeal No. 619 of 2022  allowed to the extent indicated and strike out Civil Appeal No. 13 of 2023,Struck out
47,Appeal nullified,Proceedings nullified
17,"Appeal allowed, quash the conviction, set aside the sentences meted out against the appellants. We further order that, the appellants be released forthwith from custody unless held for other lawful reasons",Allowed | Quashed | Release ordered
18,Appeal allowed the appeal thereby quash the appellants' conviction and set aside the sentences meted against them. We order their release from prison forthwith unless held for other lawful cause(s).,Allowed | Quashed | Release ordered
19,"Appeal allowed  the  appellant's conviction is quashed and the sentence meted out to him is set aside,  henceforth, order the immediate release of the appellant from prison if he is not otherwise retained for some other lawful cause",Allowed | Quashed | Release ordered
20,Appeal Allowed with costs,Allowed
21,"Appeal being unmeritorious, is dismissed in its entirety.",Dismissed
22,Appeal devoid of merit and it is hereby dismissed in its entirety.,Dismissed
23,Appeal dismissed,Dismissed
24,Appeal dismissed  with costs,Dismissed
25,Appeal dismissed with costs to the third respondent,Dismissed
26,Appeal dismiss it in its entirety,Dismissed
27,Appeal dismiss it in its entirety with costs,Dismissed
28,Appeal failed,Dismissed
29,Appeal fails and dismissed,Dismissed
30,"Appeal fails in its entirely, thus dismissed.",Dismissed
31,Appeal has no merit and it is dismissed in its entirety.,Dismissed
32,Appeal has no merit and it is dismissed it with costs,Dismissed
33,"Appeal is allowed, conviction quashed and sentence set aside. The appellants are to be set at liberty forthwith, unless otherwise lawfully held.",Allowed | Quashed | Release ordered
34,Appeal is barren of fruits and we accordingly dismiss it in its entirety,Dismissed
35,Appeal is deemed to have been withdrawn upon the expiry of the prescribed period of sixty days after its lodgment for failure by the respondent to institute the appeal upon been issued with the certificate of delay each party  to bear its own costs,Withdrawn
36,"Appeal is devoid of merit, accordingly, dismiss it",Dismissed
37,Appeal is devoid of merit and  dismissed it.,Dismissed
38,Appeal is devoid of merit and dismiss it.,Dismissed
39,Appeal is dismissed in its entirety with costs,Dismissed
40,Appeal is partly allowed,Allowed in part
41,Appeal is strike out,Struck out
42,Appeal is struck out the respondents shall have their costs,Struck out
43,Appeal is struck out with cost,Struck out
44,"Appeal is therefore allowed, the conviction is quashed and the sentence imposed on the appellant is set aside,  further orderd that the appellant be set at liberty forthwith unless he is being so held for any other lawful cause.",Allowed | Quashed | Release ordered
45,Appeal is thus dismissed with costs,Dismissed
48,Appeal partially allowed,Allowed in part
49,Appeal partly allowed,Allowed in part
50,Appeal partly is allowed,Allowed in part
51,Appeal partly succeeds to the extent of the second and third grounds of appeal.,Allowed in part
52,Appeal quashed,Quashed
53,Appeal quashed  and set aside the evidence of witnesses so that another Chairman shall hear witnesses afresh by administering oaths before taking their evidence.,Quashed | Retrial ordered
54,Appeals are dismissed for lack of merit,Dismissed
55,Appeal stand dismissed with costs,Dismissed
56,Appeal strike out,Struck out
57,Appeal strike out l with no order as to costs.,Struck out
58,Appeal struck out,Struck out
59,Appeal Struck out with costs,Struck out
60,Appeal succeeds,Allowed
61,Appeal succeeds to the extent of the fourth and fifth grounds and it is hereby allowed,Allowed
62,"Appeal without merit and, it is accordingly dismissed with costs.",Dismissed
63,Appellant be released from prison forthwith unless he is otherwise lawfully held,Release ordered
64,"Appellant may re-file his suit in the Commercial Division of the High Court as per clause 14 of the Loan Facility Letter if he so wishes. Under the circumstances of this matter, we make no order as to costs.",Struck out
65,"Appellants be released forthwith from prison, unless they be held there for other lawful cause.",Release ordered
66,Appellant shall be released forthwith from custody unless lawfully held therein,Release ordered
67,"Appellant shall remain in custody awaiting his trial, unless admitted on bail",
68,Appellant should remain in custody and another Magistrate with competent jurisdiction to entere a conviction in compliance  with section 235 (1) of the Criminal Procedure Act (CPA),
69,Appellant should remain in custody pending being committed to the High Court for trial,
70,Appellants should remain in custody pending composition and delivery of the judgment by the trial court,
71,Applicant may make an oral application before the Court in the cause of hearing of the appeal to furnish the Court with the intended additional evidence,
72,Application allowed,Allowed
73,Application allowed  for extension of time to file the appeal,Allowed
74,Application be stayed,Allowed
75,"Application declared a nullity, quashed and set aside",Quashed | Proceedings nullified
76,Application dismissed,Dismissed
77,Application dismissed in it entirely,Dismissed
78,Application dismissed  with costs,Dismissed
79,Application dismissed with costs,Dismissed
80,Application dismissed without costs,Dismissed
81,Application fails and is accordingly dismissed with costs.,Dismissed
82,"Application fails and is, accordingly, dismissed with costs",Dismissed
83,Application fails and is dismissed,Dismissed
84,Application for extension of time granted,Allowed
85,"Application for reference before the High Court judge was incompetent since such court had no jurisdiction to entertain and determine it. Consequently, we find merit in the application and grant it.",Struck out
86,Application for reference devoid of merit and it is hereby dismissed with costs.,Dismissed
87,Application for reference devoid of merit it is accordingly dismissed with costs,Dismissed
88,Application for reference is dismissed.,Dismissed
89,Application for review granted,Allowed
90,Application granted,Allowed
91,Application granted  with costs,Allowed
92,Application is allowed,Allowed
93,Application is found to be meritorious and granted,Allowed
94,Application is granted,Allowed
95,Application is hereby adjourned to a future session of the Court,Adjourned
96,Application is meritorious and thus granted..,Allowed
97,Application is strike out with costs,Struck out
98,Application is unfounded and thus dismissed it with costs.,Dismissed
99,Application is unmerited and stands dismissed.,Dismissed
100,Application lacks merit and  hereby dismiss it in its entirety,Dismissed
101,Application strike out,Struck out
102,Application strike out with costs,Struck out
103,Application struck out,Struck out
104,Application struck out  each party shall bear its costs,Struck out
105,Application struck out from the statute book,Struck out
106,Application struck out with costs.,Struck out
107,Application with no merit  and dismissed it with costs.,Dismissed
108,"Both accused persons not guilty of the offence of Murder contrary to sections 196 and 197 of the Penal Code, [Cap 16, R.E. 2002] now [R.E 2022] as charged and proceed to acquit and immediate release from prison unless otherwise lawfully held.",Acquitted | Release ordered
109,Coss-appeal is partly allowed,Allowed in part
110,Dismissed the second respondent's preliminary objection,Dismissed
111,"During the pendency of the impending appeal, the applicants should not do anything that will dissipate the value of the bank guarantee issued as security",
112,Hearing of the appeal is adjourned to a date to be fixed by the Registrar.,Adjourned
113,immediate release of the appellants from prison unless they are lawfully held.,Release ordered
114,Invoke  revisional authority in pursuance of section 4 (2) of the AJA and quash the consequential order,Quashed
115,"Invoke the  revisional powers under section 4 (2) of the Appellate jurisdiction Act [Cap 141, R.E. 2019], quash that part of the High Court order dated 10.12.2020 directing EBK to file its written statement of defence and nullify all the proceedings subsequent to that order",Quashed | Proceedings nullified
146,Strike out the notice of appeal lodged by the respondent,Struck out
147,Suit dismissed with costs,Dismissed
148,Suit granted,Allowed
149,Summary Judgement entered in favour of the plaintiffs,Allowed
116,"Invoke the  revisional powers under section 4 (2) of the Appellate jurisdiction Act [Cap 141, R.E. 2019], quash that part of the High Court order dated 10.12.2020 directing EBK to file its written statement of defence and nullify all the proceedings subsequent to that order, also quash the resultant judgment and remit the record of Commercial Case No. 105 of 2020 to the High Court (Commercial Division) for retrial of the case after the mandatory provisions of Order I rule 10 (4) of the CPC have been complied with.",Quashed | Proceedings nullified | Retrial ordered | Remitted
117,Law reform recommendation,
118,Matter is marked settled,Settled by consent
119,No merit in the preliminary objection and dismiss it with costs.,Dismissed
120,Notice of Appeal has to be amended,
121,Nullify the proceedings and judgment of the Tribunal and that of the High Court,Proceedings nullified
122,Objection overruled,Dismissed
123,Objection sustained,Allowed
124,Petition dismissed,Dismissed
125,Petition partially succeed,Allowed in part
126,Preliminary objection is overruled with costs.,Dismissed
127,Preliminary Objection  overlewd with no  costs,Dismissed
128,"Preliminary objections are devoid of substance, they are accordingly overruled with costs",Dismissed
129,Proceedings nullified ito section 4(2) of the AJA,Proceedings nullified
130,Quashed,Quashed
131,"Quashed the conviction and set aside the sentence awarded to the appellant, and order his immediate release from prison unless lawfully held.",Quashed | Release ordered
132,"Quashed the judgments and set aside the orders, we remit the record to the trial Tribunal for it to conduct an expedited retrial according to law.",Quashed | Retrial ordered | Remitted
133,Quash his conviction and set aside the sentence immediate release from prison.,Quashed | Release ordered
134,Quash the conviction and set aside the sentence imposed on the appellant and  the appellant be set free unless he is being held for other lawful cause.,Quashed
135,"Quash the proceedings before the High Court as well as the judgment, and set aside the resultant orders",Quashed
136,Reference Dismissed,Dismissed
137,"Reference is unmerited, it stands dismissed.",Dismissed
138,Reject the applicant's motion for change of panel or for the recusal of one of us because that is against the clear provisions of rule 66 (5) of the Rules,Court recused
139,"Respective trial court's proceedings as a nullity., consequently,  the court  nullify the same from the date the respondent filed the amended written statement of defence and set aside the decree",Proceedings nullified
140,Retrial,Retrial ordered
141,Revision granted,Allowed
142,Second ground of appeal has merit   allow it to that extent with costs.,Allowed
143,Set aside the sentence,Sentenced
144,strike it out each party shall bear his own costs.,Struck out
145,Strike out the application with costs.,Struck out
150,"The Court decline to entertain the application in terms of rule 60(1) of the Rules, therefore,  adjourned  the hearing of the application for determination by the Court.",Adjourned
151,The matter to be remitted to the trial court for a trial to be conducted as expeditiously as possible,Remitted
152,The prayer for extension of time is granted to allow the applicant to lodge the contemplated appeal to the Court,Allowed
153,"In terms of section 4 (2) of the AJA, we quash the proceedings and resultant judgments of both lower courts set aside the sentences meted out against the appellants and order for an expedited retrial before another magistrate with competent jurisdiction.",Quashed | Retrial ordered
154,"Appeal succeeds to the extent stated, it being a matter falling within the realm of labour disputes, which, ordinarily, in terms of rule 51(1) 21 of the Labour Court Rules, 2007 - GN No. 106 of 2007.",Allowed
155,"Nullify the proceedings of the trial court, quash the judgment and set aside the decree, further make an order for an expedited retrial of the suit by another Judge",Quashed | Proceedings nullified | Retrial ordered
156,Stay execution of the decree of the High Court of Tanzania at Moshi in Land Case No. 10 of 2016 dated 08/06/2017 on condition that the applicant puts in the Court a Certificate of Title for such a plot as promised with at least half value of the disputed land immediately.,Allowed
157,The entire appeal is hereby dismissed.,Dismissed
158,Appeal is struck out and the decision of the High Court nullifying the  award of the CMA,Struck out | Proceedings nullified
159,Appeal granted,Allowed
160,Hearing of appeal is adjourned to another convenient sessions of the Court as it will be fixed by the Registrar after the intended additional evidence has been taken and certified to the Court by the trial court.,Adjourned
161,Suit  dismissed without costs,Dismissed
162,"Invoke  revisional powers bestowed  under section 4 (2) of the Appellate Jurisdiction Act, [Cap 141 R.E. 2019] and nullify the proceedings and judgment of the first appellate court in Criminal Appeal No. 65 of 2021, quash the upholding of conviction and sentence.",Quashed | Proceedings nullified
163,Strike out the appeal with costs for being time barred,Struck out
164,Appeal allowed  on the strength of the third ground,Allowed
165,"invoke revisional powers under rule 4(2) of the Tanzania Court of Appeal Rules, 2009 and revise the judgments and proceedings of both the District Court and the High Court, set aside the judgments of the two courts below, quash the proceedings thereof and restore the decision of the primary court",Quashed
166,Appeal dismissed in its entirety,Dismissed
296,Application is found to be time barred and dismissed with costs.,Struck out | Dismissed
167,"Appeal allowed and quash the appellant's conviction, set aside his sentence of death; and finally order his immediate release from prison, unless he is held there for any other lawful cause",Allowed | Quashed | Release ordered
168,"The proceedings and the judgment of the High Court in Economic Case No. 3 of 2021 are nullified, the conviction and sentences meted to the appellants are vacated and set aside and  direct the case to be heard afresh by another Judge of competent jurisdiction after receiving the consent from the DPP on the offence charged. The appeal is allowed to the extent.",Settled by consent | Allowed | Proceedings nullified | Retrial ordered | Sentenced
169,Appeal dismiss it entirely,Dismissed
170,Quash the conviction and set aside the sentence of 30 years imprisonment on the appellant. We order the immediate release of the appellant from prison unless he is being held there for another lawful cause.,Quashed | Release ordered
171,Appeal dismissed it entirely,Dismissed
172,Appeal dismiss it on its entirety,Dismissed
173,"Appeal allowed  the appeal, nullify the trial court's proceedings, quash conviction and set aside the appellant's sentence,  order a retrial of the appellant before a competent court upon receipt of a valid consent from the DPP. In the meantime, the appellant shall remain in custody pending retrial.",Settled by consent | Allowed | Quashed | Proceedings nullified | Retrial ordered
174,"The sentence of thirty years imprisonment is quashed and substituted with that of fifteen years' imprisonment, appeal partly allowed.",Allowed in part | Quashed | Sentenced
175,Appeal is devoid of substance and dismiss it with costs.,Dismissed
176,"The Court find merit in the sole ground of appeal and proceed to allow the appeal, consequently nullify the proceedings before the CMA and the decision thereon. Furthermore, quash the judgment of the High Court.",Allowed | Quashed | Proceedings nullified
177,Dismissed the appellant's appeal in its entirety,Dismissed
178,"The matter before this court is, by the consent of both parties, marked settled as per the terms and conditions contained in the deed of settlement",Settled by consent
179,Allowed the 3rd ground of appeal. going forward  direct that the record to be remitted to the trial court for the hearing de novo.,Allowed | Remitted
180,"The review proceedings are hereby nullified, the decision of the review and the subsequent orders are set aside remit the record to the High Court for fresh hearing and determination of the application for review. For avoidance of doubts, the said application shall be heard and determined by a Successor Judge.",Proceedings nullified | Remitted
181,"The entire Preliminary Objections have no legal basis and, are hereby overruled.",Dismissed
182,"Defendants liable for defamation and, hereby grant Plaintiff  reliefs.",Allowed
183,Whereby contributory negligence is involved.,
184,Application is hereby struck out with costs.,Struck out
185,"Application is hereby marked withdrawn with leave to refile under Rule 55 (1) and (2) of the Labour Court Rules,  the same be refiled within fourteen (14) days from the ruling hereof.",Withdrawn
186,Allow the second appellant's appeal and order his immediate release from prison if he is not otherwise being held lawfully.,Allowed | Release ordered
187,"Appeal allowed ,  further quash the conviction against the appellant and set aside the sentence imposed on the appellant.",Allowed | Quashed
188,"Appellant shall remain in custody pending retrial before a competent court,  further order that, should the appellant be found guilty and convicted, the served time in jail should be included in the jail term to be imposed.",Retrial ordered | Convicted
189,"Appeal allowed, quash the judgment of both lower courts and set aside the sentence imposed on the appellant, order the appellant's immediate release if he is not being held in custody for some other lawful cause.",Allowed | Quashed | Release ordered
190,"Appeal succeeds, with the end result that the judgment of the High Court in relation to the appellant is quashed, and its orders set aside. Although the judgment of the District Court appears to be failing short for not apportioning damages.",Allowed | Quashed
191,"Appeal allowed, quash the conviction and set aside the sentence. We further order the immediate release of the appellant from prison unless he is otherwise lawfully held.",Allowed | Quashed | Release ordered
192,"Appeal partly succeeds to the extent of the fourth and fifth grounds and fails to the extent of the first, second and third grounds, vary the judgment of the first appellate court so that the appellant's appeal thereat is dismissed to the extent of the 1st, 2nd and 3rd grounds and allowed to the extent of the 4th and 5th grounds. The awards of 40% value of the motor vehicle and possession of the two machines are quashed and set aside.",Allowed in part | Dismissed | Quashed
193,"Execution of the Award in Execution No. 12 of 2024 pending before the Land and Housing Tribunal at Chato is hereby stayed pending hearing and determination of the intended appeal on condition that; the applicants execute within fourteen days from the date of delivery of this ruling, a written bond undertaking to vacate from the suit land as ordered by the High Court in case the appeal is not decided in their favour.",Allowed
194,"Prosecution case was not proved beyond reasonable doubt, thus allow the appeal, quash the conviction and set aside the sentence of life imprisonment imposed on he appellant,  finally order the appellant's release from prison unless his continued incarceration is related to other lawful cause.",Allowed | Quashed | Release ordered
358,The Court  find the entire appeal devoid of merits and accordingly dismiss it.,Dismissed
195,"Trial court had jurisdiction to entertain the appellant's application to investigate the ownership of the motor vehicle,  thus allow the appeal, quash the ruling of the trial court and the resultant judgment of the High Court on an appeal and set aside all orders made thereto,  make a direction that, the original record be remitted to the trial court for hearing and determination on merit of Miscellaneous Criminal Application No. 1 of 2021 by another magistrate of competent jurisdiction.",Allowed | Quashed | Remitted
196,"It is partly allow the appeal, quash the conviction of murder and substitute it with the conviction of manslaughter, accordingly, set aside the sentence of death by hanging imposed by the trial court to the appellant, considering the circumstances pertaining to the killing of the deceased, and the period that the appellant has been in custody,  impose a term of imprisonment of fifteen years from the date of the appellant's conviction, that is, 8th July, 2022.",Allowed in part | Quashed | Sentence substituted
197,Access acquited,Acquitted
198,"Appellant, for the personal injuries suffered, is entitled to compensation in the form of special damages which, as we have found and held above, he specially pleaded and strictly proved as well as general damages grantable at our discretion. However, given that he contributed to the occurrence of the accident as already observed above, we order that he is entitled to only 75% of the total amount awarded as special and general damages, the decretal sum shall attract an interest of 7% at the court's rate from the date of judgment to the date of its satisfaction in full.",Allowed in part
199,"Court find merit in this  Application  considered opinion that the applicants gave plausible reasons which amounted to good cause to warrant extension of time under rule 10 of the Rules. Consequently, the applicants are given 60 days from the date of delivery of this ruling to lodge their memorandum and record of appeal.",Allowed
200,"Sentence of the accused shall start from 2nd November, 2023 because the irregularity was prompted by the trial court.",Sentenced
201,"The matter before this court is, by the consent of both parties, marked settled as per the terms and conditions contained in the deed of settlement.",Settled by consent
220,"Applicant has failed to comply with the two conditions listed under rule 11 (5) of the Rules, cumulatively. Consequently, for above given reasons, the appiication is accordingly dismissed with costs.",Dismissed
344,"Appeal is hereby dismissed under section 3 (1) of the Law of Limitation Act, Cap. 89 R.E 2019 for being time barred.",Struck out | Dismissed
578,Remitted to High Court for determination on merits,Allowed | Remitted
202,"General damages arising from the appellant's act of unlawfully evicting the 1st respondent and her children thereby causing them mental anguish and inconvenience, the amount of TZS 30,000,000.00 will meet the justice of the case, therefore, reduce the amount of the general damages awarded by the trial court to the above stated amount. The amount shall attract interest at the court's rate of 7% from the date of the trial court's judgment to the date of full payment this is in accordance with Order XX rule 21 of the Civil Procedure Code, Chapter 33 of the Revised Laws.",Allowed in part
