ID,Name,canonical_outcomes
476,"In view of what the Court has  endeavoured to discuss above, the Court  grant the prayer. Consequently, in terms of Rule 99 (1) of the Rules,  order that the respondent should file a supplementary record of appeal which will include the pleadings in Commercial Case No. 128 of 2021 and the",Allowed
477,In view of what the Court has  discussed  satisfied that the appeal has no merit and  dismiss it.  The Court  make no order as to costs as this is a labour matter and no party pressed for it.,Dismissed
478,"With these infractions the Court  agree with all learned counsel that both cautioned statements were wrongly admitted and hence deserves to be expunged as we hereby do. That said and done, if the two cautioned statements are expunged, there remains no other evidence to sustain the conviction. Consequently, the Court  allow the appeal, quash the conviction entered against the appellants and set aside the sentences meted out against them,  further order for their immediate release from custody unless otherwise are held for other lawful cause(s).",Allowed | Quashed | Release ordered
479,"Besides that,the Court  considered the appellant's prayer to have the motor vehicle returned to him. Indeed, the record bears that the application for forfeiture was made and granted under section 9 (1) of the Proceeds of Crimes Act, Cap 256 (the PCA). In view of section 17 (1) of the PCA, having quashed the conviction upon which the forfeiture order hinged, the Court  hereby order for the discharge of the motor vehicle, subject of the forfeiture order.",Allowed | Quashed | Discharged
480,"The Court  satisfied that the case against the appellant was proved to the hilt. Eventually,  find this appeal meritless and  dismiss it in its entirety.",Dismissed
481,"For the reasons discussed the Court  dismiss the appeal against conviction as it has no merit bearing in mind that not only did the prosecution witnesses prove the case but even the appellant advanced it. The Court  however allow the appeal in respect of the sentence and vary it accordingly for the reasons shown earlier. The appellant shall serve a sentence of 30 years imprisonment instead of the imposed life imprisonment which we hereby set aside. Except for the variation in the sentence, this appeal is dismissed.",Dismissed | Sentenced
482,This appeal is dismissed in its entirety.,Dismissed
483,"With the foregoing, the appeal partially succeeds, the Court  quash the conviction and set aside the sentence in relation to the offence of impregnating a school girl. In relation to the offence of rape, the appeal is devoid of merit and accordingly, dismiss it in its entirely.",Allowed in part | Dismissed | Quashed
484,"The totality of the foregoing discussion leads us to the conclusion that the prosecution case was marred with doubts which need to be resolved in favour of the appellant. In the circumstances, the Court has  constrained to allow the appeal, quash the appellant's conviction and set aside the sentence meted out against the appellant. Ultimately,  order or the release of the appellant forthwith unless held for some other lawful cause(s)",Allowed | Quashed | Release ordered
485,"For the foregoing reasons, the Court  hold that the appellant has not substantiated the merits of the appeal which accordingly dismiss with costs.",Dismissed
486,"Ultimately, the Court  allow the appeal to the extent that has been designated. Consequently, we render judgment in favour of the appellant in the amount of US$ 132,639.30. The appellant's remaining claim stands dismissed. Due to the circumstances of this case, the Court  order each party to bear its own costs.",Dismissed
487,"For the foregoing, the Court  view that, the applicant has complied with the requisite conditions outlined for a stay of execution order to be granted as stipulated under rule 11 of the Rules. In view of the circumstances of the matter at hand, the application is allowed, and it is hereby ordered that execution of the decree in Land Case No. 12 of 2008 dated 17th March, 2023 is stayed pending the hearing and final determination of the appeal. This order is conditional upon the applicants depositing a bank's guarantee of US$ 14,400 as a security for the due performance of the decree within a month to be reckoned from the date of delivery of this ruling. I make no order as to costs.",Allowed
488,"For the foregoing reasons, the Court  do not find any cogent reasons to disturb the concurrent findings of the lower courts, as we are satisfied that the evidence taken as a whole establishes that the prosecution's case against the appellant was proved beyond reasonable doubt. In the event, the Court  find the appeal devoid of merit and it is hereby dismissed in its entirety.",Dismissed
489,"In view of the circumstance of this matter, the Court  uphold the submission by the learned Principal State Attorney that the interests of justice in the matter at hand demand that there should be a retrial before the High Court. thus order the case to be tried afresh by a court of competent jurisdiction, subject to the consent of the DPP to prosecute the appellant. In the meantime, the appellant shall remain in custody to await the resumption of the trial.",Settled by consent | Retrial ordered
490,"Consequently, the Court  order that the stay of execution of the decree be conditioned on the furnishing, by the applicant, of a bank guarantee amounting to Euros 1,000,000.00. The bank guarantee should be furnished to the Court within sixty days from the date hereof. The applicant is further ordered to ensure that nothing dissipates the value of the bank guarantee for the entirety of the period of validity of the guarantee,  make no order as to costs.",Allowed
491,"Consequently, the Court allow the appeal, quash conviction and set aside the appellant's sentence,  order his immediate release from prison, unless he is otherwise lawfully held.",Allowed | Quashed | Release ordered
492,"The Court, in view thereof, find nothing unusual or erroneous in the learned Judge's stance of the matter. It was in keeping with the duty that the court had in the matter. In consequence,  find this ground of appeal hollow and dismiss it. Overall, the Court  find nothing meritorious in this appeal. Accordingly,  dismiss it with no order as to costs.",Dismissed
493,"This appeal has merit, and the Court  will allow it accordingly. The Judgment and the Decree of the High Court Labour Division in Labour Revision No. 08 of 2021 is quashed and set aside, the Court  restore the Award of the CMA. Each side shall bear its costs.",Allowed | Quashed
494,"The Court stated that the ability of a witness to name a suspect at the earliest opportunity is an all-important assurance of his reliability. Therefore,  dismiss grounds number 1, H( 3 and 6 for lack of merits. The Court  otherwise have no reason to doubt that the prosecution proved its case beyond reasonable doubt. As a result,  dismiss this appeal in its entirety.",Dismissed
495,"For the foregoing reasons, the Court  dismiss the appeal and direct that the record of the DLHT be remitted back for it to proceed with application for execution (Application No. 88/2013) and determine objections, if any. The respondent to have costs of this appeal.",Dismissed | Remitted
496,"With the few pointed out defects we entirely agree that retrial will be prejudicial to the appellants. In the end,  the Court  proceed to allow the appeal, nullify the proceedings, quash the conviction and set aside the sentence. All three appellants be released from prison unless being held for some other lawful reasons.",Allowed | Quashed | Proceedings nullified | Retrial ordered | Release ordered
497,"In the result, the Court  allow the appeal, quash the appellants' convictions and set aside the sentences, the Court  hereby order that they should be released from prison forthwith if not held for another lawful cause.",Allowed | Quashed | Release ordered
498,"For the reasons stated above, the Court has  convinced that the prosecution case was tainted with serious potholes rendering involvement of the appellant in the murder of Ligwa Matemani doubtful, the appeal has merit and the Court allow it, quash the trial court's conviction and set aside the sentence rendered to the appellant, the Court  hereby order that he be released forthwith if no other cause holds him behind the prison bars.",Allowed | Quashed | Release ordered
499,"In the event, the Court  find the appeal devoid of merit and dismiss it in its entirety.",Dismissed
500,"In the circumstances, the Court  order that, the record be remitted to the trial court for the case to be heard afresh from the stage where the first trial commenced. Meanwhile, the appellants shall remain in custody. the Court  equally order for the said retrial to be expedited.",Retrial ordered | Remitted
501,"In conclusion, while the Court  allow the appeal on the second count and proceed to quash the conviction and set aside the sentence on it,  the Court  dismiss the appeal as regards the first count. For avoidance of doubt, the appellant shall continue to serve his thirty years imprisonment on the first count.",Dismissed | Quashed
502,"Accordingly, the execution of the decree of the High Court of Tanzania at Tanga in Land Case No. 7 of 2007 is hereby stayed pending hearing and determination of the intended appeal on the following conditions: (i)	The applicant desists from disposing of or in any way alienating the suit property. (ii)	The applicant executes and deliver to the Registrar of the Court a bank guarantee of USD 300,000,000.00. within 30 days from the date hereof. (iii)	The applicant executes and deliver to the Registrar of the Court within the same period, a bank guarantee of TZS 151,133,333.33 being the decretal sum and interest inclusive as of the date of the filing of the application for execution. (iv)	Costs to follow events.",Allowed
503,"In these circumstances, the Court  satisfied that the application has merit and therefore, it is granted. Consequently, the Court  order that, the intended execution of the Decree of the Court of Resident Magistrate of Dar es Salaam at Kisutu in Execution No. 107 of 2023 be stayed pending hearing and determination of the intended appeal. Since the applicants on 9th January, 2024 deposited security in a form of Bank Guarantee from Azania Bank PLC for the contested amount of TZS. 134,400,000.00 that security shall remain valid for twenty-four months renewable to cover the whole period until the appeal is conclusively determined. Costs shall abide the outcome of the appeal.",Allowed
504,"For the reasons stated above, the application has merit and is hereby granted. Accordingly, the execution of the decree of the High Court dated 25th August, 2023 in Land Appeal No. 234 of 2023 is hereby stayed pending hearing and determination of the intended appeal. The said stay is, however, subject to the applicant depositing in the Court within thirty days of the delivery of this ruling a bank guarantee for the sum of TZS. 191,664,000.00. Accordingly, the said guarantee shall remain in force until full hearing and determination of the intended appeal by this Court. In default, the order of stay shall lapse automatically. In the circumstances, costs shall follow events.",Allowed
505,"In this appeal, as determination of the above two grounds of appeal has the effect of determining the entire appeal, the Court  find no reason to engage in determining the other grounds of appeal. Finally, the Court  allow the appeal and quash the conviction of the appellant. Further, the appellant's sentence of thirty years imprisonment is hereby set aside, and order his immediate release from prison, unless he is held there for any other lawful cause.",Allowed | Quashed | Release ordered
506,"Finally, and in view of the above discussion, the Court  allow the appeal and quash the appellant's conviction. His sentence of thirty years imprisonment is hereby set aside. The Court  finally order his immediate release from prison, unless he is held there for any other lawful cause.",Allowed | Quashed | Release ordered
507,"Flowing from the foregoing, it is clear that good cause has been shown for the granting of extension of time. Consequently, the Court  hereby grant it. make no order for costs in order to revive harmony amongst the parties who are relatives.",Allowed
508,"In conclusion, the Court  satisfied that, no good cause has been shown for the granting of extension of time. Consequently, the Court  hereby dismiss the application with costs for being unmerited.",Dismissed
509,"Consequently, under section 4 (2) of the Appellate Jurisdiction Act, Cap. 141 Revised Laws, we quash the entire proceedings before honourable Ngaeje, SRM - Ext. Juris, and the resultant judgment and orders stemming from those proceedings. On the way forward, we order the record in Criminal Appeal No. 66 of 2021 to be remitted to the High Court for a hearing of the appeal or otherwise, properly transfer it to RM-Ext. Juris. For the foregoing, the Court  allow the appeal, quash the proceedings, judgment and orders therefrom. In the meantime, the appellant shall remain in custody.",Transferred | Allowed | Quashed | Remitted
510,"In the final end, the Court  sustain the objection and hereby struck out the appeal for being time barred. Being a labour matter no order for costs is made.",Struck out
511,"On the basis of the foregoing, the Court  allow the appeal, nullify the proceedings, quash the ruling and set aside the orders of the High Court,  direct that, the High Court should continue to hear the preliminary objection in the light of the attack launched on the affidavit sworn in support of the application for extension of time. Needless to say, depending on the outcome of the preliminary objection, the High Court should hear and conclude the proceeding according to law. Since the mix up leading to the present appeal was partly caused by the present appellant, and there was neither fault nor stratagem on the part of the respondent,  order for each party to bear their own costs.",Allowed in part | Quashed | Proceedings nullified
512,"All said and done, the Court  allow the appeal to the extent that there was no proper transfer of Criminal Appeal No. 68 of 2020 from the High Court to the Resident Magistrate' Court for it to be heard and determined by a resident magistrate with extended jurisdiction. All the proceedings before the Resident Magistrates' Court including the judgment by S.B. Nsana SRM Ext. Jurisd are a nullity, order the High Court record in Criminal Appeal No. 68 of 2020 be remitted to the High Court for it to deal with it according to law,  direct that the appeal be expeditiously heard and determined. Meanwhile, the appellant has to remain in prison custody awaiting to prosecute his appeal before the High Court.",Transferred | Allowed | Proceedings nullified | Remitted
513,"The Court  minded to allow the appellants' appeal, quash their respective convictions and also set aside the sentences meted against each of them, the Court  hereby order that they should be set at liberty if nothing lawful holds them in prison.",Allowed | Quashed | Release ordered
514,"In the final result, both the appeal and cross appeal are without merit and are hereby dismissed. This being a labour matter, the Court make no order as to costs.",Dismissed
515,"The Court  undoubtedly find the trial was vitiated,  hold that, the trial conducted without framing issues was a nullity and hereby quashed. So is the judgment and decree that followed. Going forward, the Court  order that the record be remitted to the High Court for a retrial before another Judge. For the reasons given, the Court  allow the appeal but with no order for costs.",Allowed | Quashed | Proceedings nullified | Retrial ordered | Remitted
516,"That said, the appeal stands allowed. Since the appeal emanates from a labour dispute in which costs are ordinarily not awardable, the Court  order that each party bears own costs.",Allowed
517,"In view of the foregoing, the Court  find merit in the application and  grant it. Accordingly, the notice of appeal lodged on 24th October, 2022 is struck out with costs. Ordered accordingly.",Struck out
518,"As this ground is sufficient to dispose of the appeal, the Court  shall not address the rest of the grounds of appeal. Consequently,  quash the judgment of the High Court and order a fresh hearing of the first appeal according to law. Meanwhile the appellant to remain in custody to wait for the re-hearing of the first appeal, which should be as soon as possible.",Quashed
519,"On the whole, the Court  find the application merited and grant it. Consequently, the notice of appeal lodged on 26 October, 2021 is hereby struck out as prayed in the notice of motion. Considering the nature of the dispute giving rise to the application, the Court  make no order as to costs. Order accordingly.",Struck out
521,"It is my considered view that the application before the Court  lacks the qualities of a competent application. It follows that the same must fall through, and accordingly,  the Court strike it out with no order as to costs. It is so ordered",Struck out
522,"The Court  view that the application  lacks the qualities of a competent application. It follows that the same must fall through, and accordingly,  strike it out with no order as to costs. It is so ordered.",Struck out
523,"For those reasons, this application has not met the threshold for this court to exercise the discretion to grant bail pending appeal. As the result, the application is hereby dismissed for want of merit. Order accordingly.",Dismissed
524,"Consequently, the Court  take heed and grant leave to the cross appellant  to lodge a supplementary record of appeal to accommodate the certified  record of proceedings within sixty (60) days from the date of this decision. Costs to abide the outcome of the cross appeal.",Allowed
525,"The Court has the  view that, it has  sufficient to dispose of this application and find no need to consider the remaining ground since it falls within the ambit of what has been deliberated and determined in those two grounds. In the end, the Court  dismiss the application for lack of merit and  make no orders as to costs.",Dismissed
526,"In consequence, the proceedings and judgments of the High Court, DLHT are nullified as they were based on an erroneous judgment of the Ward Tribunal. Parties are at liberty to institute fresh proceedings in a competent forum under the law and procedure.",Proceedings nullified
527,"In the end, the Court  allow the application and waive the requirement for service on the 2nd and 3rd respondents with the notice of appeal and the letter requesting to be supplied with proceedings, judgment and decree. The applicant may proceed with other steps necessary for the realisation of the appeal. In the circumstance of the present application, the Court  make no order as to costs.",Allowed
528,"This application is allowed. For that matter, time to deposit bank guarantee is extended for a period of forty-five (45) days from the issuance of this decision. Cost of the application to abide the outcome of the appeal.",Allowed
529,"In fine, the Court  allow the appeal and  order the record of appeal of the High Court in Criminal Appeal No. 10 of 2021 to be remitted back to the High Court for compliance with the law, the Court  also direct the appeal hearing to be expeditiously conducted. Meanwhile, the appellant has to remain in prison custody.",Allowed | Remitted
530,The Court  declare the appeal time barred and accordingly strike it out with costs.,Struck out
531,"From the foregoing, it may be apparent that, effective remedies to address the appellant's complaints exist within the ordinary laws and, therefore, the petition, as correctly decided by the High Court, was premature for want of exhaustion of the available remedies. The appeal is, therefore, dismissed for being without merits. This being an appeal arising from the enforcement of the basic rights and duties, the Court  shall not give an order as to costs.",Dismissed
532,"In the upshot, the Court  find that the appeal is devoid of merit and we proceed to dismiss it. In the circumstances of the present appeal, the Court  make no order as to costs.",Dismissed
533,"In the final analysis, the Court  allow the appellant's appeal, quash the decree of the High Court, set aside the orders for paying both punitive and general damages as weil as waive the restraint order against the appellant and its associates. The appellant shall have costs of the case here and before the High Court.",Allowed | Quashed
534,"In the event, and for the foregoing, the Court  satisfied that the application at hand is meritorious. Accordingly, the Court  constrained to allow it. Consequently, in terms of rule 89 (2) of the Rules, the notice of appeal filed by the respondent on 28th February, 2022 is hereby struck out. In the circumstances of the present application, the Court  do not make an order as to costs. It is so ordered.",Struck out
535,"For those reasons, the Court  grant this application and hereby order stay of execution of the decree of the High Court (Land Division) in Land Case No. 51 of 2016, until determination of the intended appeal. This order is on condition that the applicants execute a bond committing to maintain the status quo of the suit land subject of the decree within sixty (60) days from the date of delivery of this ruling. Costs shall abide the main cause.",Allowed
536,"In the circumstances of this application, the Court  inclined to grant this uncontested application and order stay of execution of the decree in Commercial Case No. 153 of 2013, on condition that the applicant deposits a bank guarantee at the tune of TZS. 324,189,305/= not later than ninety (90) days from the date of this order. Costs shall abide the main cause. It is so ordered.",Allowed
552,"For the foregoing reasons and being guided by the aforementioned authorities, the appeal is allowed solely on the ground raised by this court suo mottu. The conviction is hereby quashed and the sentence is set aside. Further, I order that the appellant be released from custody and be set free forthwith unless he is held for some other lawful cause. Order accordingly",Allowed | Quashed | Release ordered
537,"Having said so, the Court  hereby grant the application for stay of execution of the decree in Labour Revision No. 366 of 2022, originating from Labour Dispute No. CMA/DSM/KIN/380/2020/178/20/20 subject to applicant giving security for the due performance of decree in a form of a bank guarantee of the decretal sum within sixty (60) days from the date of this ruling. The order is made, pending hearing and determination of the intended appeal. Costs be in due course.",Allowed
538,"In the circumstances of this application, the Court inclined to grant this application as the Court  hereby do in terms of rule 11 (3) and (5) of the Rules, on condition that the applicant deposits a bank guarantee in favour of the respondent at the tune of TZS. 466,800,000/= not later than 60 days from the date of this Order. Costs to abide the results of the intended appeal.",Allowed
539,"In the light of the above, this appeal has merit to the extent explained in ground four on costs and otherwise it is accordingly dismissed.",Dismissed
540,"With the above discussion, there is no need of getting to issues of procurement of the bank guarantee or an insurance bond, because, in order to consider security for due performance of the decree, substantial loss must be demonstrated first. That said and done, this application has no merit. It is hereby dismissed with costs.",Dismissed
541,"As to the way forward, the Court  accede to the proposal by the learned Senior State Attorney. Hence, the Court  invoke our revisional powers bestowed on us under section 4 (2) of the AJA and nullify the proceedings and judgment of the High Court and remit the matter to the High Court for an expedited hearing of the appeal before another Judge. It is so ordered.",Proceedings nullified | Remitted
542,"In the event, the Court  find that, this appeal has been brought without sufficient grounds, the Court  thus hereby dismissed it in its entirety.",Dismissed
543,"The Court  satisfied that the applicant has met all the conditions. I thus hereby grant the application and order that execution of the decree in Miscellaneous Civil Application No. 820 of 2016 be stayed pending a hearing of the intended appeal. This order is, however, subject to the applicant's deposit of the original Certificates of Titles with numbers 124738, 97819, 97764, 97728 and 123752 in the name of Simba Motors Ltd in the alternative the applicant to deposit with the Registrar of the Court an irrevocable bank guarantee in the sum of USD 300,000. The intended bank guarantee should be amenable to renewal to cover the whole period until the pending appeal is determined and it should be deposited within sixty (60) days from the date of this order.",Allowed
544,The application is hereby struck out for being incompetent with no order for costs. It is so ordered.,Struck out
